{
  "$schema": "../schemata/quellenregister.schema.json",
  "schema_version": "1.0.0",
  "projektversion": "0.4.0",
  "dokumentstatus": "ÖFFENTLICH – organisationsneutrale Referenzvorlage",
  "stichtag": "2026-10-06",
  "zitierregel": "Nummerierte Kurzverweise im Fachtext. Vollständige bibliografische Angaben und öffentliche Links ausschließlich im Quellenverzeichnis. Quellen-IDs bleiben im Katalog und Register stabil.",
  "quellen": [
    {
      "id": "Q-BMI-001",
      "oscal_uuid": "6292a64c-f4d5-5364-b3ac-1b3ecb42ae2f",
      "titel": "Leitlinien für den Einsatz Künstlicher Intelligenz in der Bundesverwaltung",
      "herausgeber": "Bundesministerium des Innern und für Heimat / Beratungszentrum für Künstliche Intelligenz",
      "dokumentart": "Behördliche Leitlinie",
      "fassung": "Erstfassung",
      "stand": "PDF-Stand 07.04.2025",
      "veröffentlichungsdatum": "2025-04-07",
      "gültigkeitsdatum": null,
      "öffentliche_url": "https://www.bmi.bund.de/SharedDocs/downloads/DE/publikationen/themen/moderne-verwaltung/ki/BMI25020-leitlinien-ki-bundesverwaltung.html",
      "abrufdatum": "2026-09-02",
      "letzte_inhaltsprüfung": "2026-09-02",
      "lokale_fassung": {
        "pfad": "quellen/lokale-eingaben/BMI25020-leitlinien-ki-bundesverwaltung.pdf",
        "dateigröße_bytes": 1022950,
        "sha256": "ab01cfbbc6beb216fa6cc84774aab927efd192168e254e29a6202d8df229a325",
        "offizielle_pdf_url": "https://www.bmi.bund.de/SharedDocs/downloads/DE/publikationen/themen/moderne-verwaltung/ki/BMI25020-leitlinien-ki-bundesverwaltung.pdf?__blob=publicationFile&v=4",
        "offizielle_sha256_am_prüftag": "ab01cfbbc6beb216fa6cc84774aab927efd192168e254e29a6202d8df229a325",
        "vergleich": "binär-identisch"
      },
      "seitenzahl": 32,
      "geltungsbereich": "Bundesverwaltung; verantwortbarer Einsatz generativer KI",
      "autoritätsstufe": "3-offizielle-empfehlung",
      "lizenz_und_wiederverwendung": "Amtliches Werk beziehungsweise behördliche Veröffentlichung; Nachnutzung vor Weiterveröffentlichung prüfen.",
      "aktualitätsstatus": "geprüft",
      "vorgänger": null,
      "nachfolger": null,
      "wiedervorlage_am": "2027-09-02",
      "verwendete_fundstellen": [
        {
          "fundstelle": "S. 25–29",
          "aussage": "Datensparsamkeit, Schutzbedarf, Rollen, zulässige Infrastruktur, Datenschutz, Nutzungsvorgaben und Ergebnisprüfung."
        },
        {
          "fundstelle": "S. 30",
          "aussage": "Bewusste Eingabeformulierung und Umgang mit unzutreffenden KI-Ausgaben."
        }
      ],
      "abgeleitete_kontrollen": [
        "ki-arc-002",
        "ki-ext-001",
        "ki-gel-002",
        "ki-gov-002",
        "ki-iam-001",
        "ki-out-001",
        "ki-rag-004",
        "ki-rec-002"
      ]
    },
    {
      "id": "Q-BSI-001",
      "oscal_uuid": "2d875bf4-6d55-554f-a746-b2613297ea71",
      "titel": "Kriterienkatalog des BSI zur Integration von extern bereitgestellten generativen KI-Modellen in eigene Anwendungen",
      "herausgeber": "Bundesamt für Sicherheit in der Informationstechnik",
      "dokumentart": "Behördlicher Kriterienkatalog",
      "fassung": "Version 1.0",
      "stand": "06.06.2025",
      "veröffentlichungsdatum": "2025-06-06",
      "gültigkeitsdatum": null,
      "öffentliche_url": "https://www.bsi.bund.de/SharedDocs/Downloads/DE/BSI/KI/Kriterienkatalog_KI-Modelle_Bundesverwaltung.pdf?__blob=publicationFile&v=3",
      "abrufdatum": "2026-10-06",
      "letzte_inhaltsprüfung": "2026-10-06",
      "lokale_fassung": {
        "pfad": "quellen/lokale-eingaben/Kriterienkatalog_KI-Modelle_Bundesverwaltung.pdf",
        "dateigröße_bytes": 353317,
        "sha256": "f7fcc0e47d9d7891b398dc91aef78c4f3b72cf14c41ac19df0eef580d82a07c3",
        "offizielle_pdf_url": "https://www.bsi.bund.de/SharedDocs/Downloads/DE/BSI/KI/Kriterienkatalog_KI-Modelle_Bundesverwaltung.pdf?__blob=publicationFile&v=3",
        "offizielle_sha256_am_prüftag": "f7fcc0e47d9d7891b398dc91aef78c4f3b72cf14c41ac19df0eef580d82a07c3",
        "vergleich": "binär-identisch"
      },
      "seitenzahl": 16,
      "geltungsbereich": "Bundesverwaltung; Integration generativer KI-Modelle in Anwendungen",
      "autoritätsstufe": "3-offizielle-empfehlung",
      "lizenz_und_wiederverwendung": "Behördliche Veröffentlichung; nur kurze sinngemäße Ableitungen und bibliografische Angaben genutzt.",
      "aktualitätsstatus": "geprüft",
      "vorgänger": null,
      "nachfolger": null,
      "wiedervorlage_am": "2027-10-06",
      "verwendete_fundstellen": [
        {
          "fundstelle": "S. 4–7",
          "aussage": "Geltungsbereich sowie Bedeutung von MUSS-, SOLLTE- und KANN-Anforderungen."
        },
        {
          "fundstelle": "S. 8–10",
          "aussage": "KI-Verantwortung, Inventar, Nutzungsregeln, Risikobewertung, Modellwahl und vertrauenswürdige Quellen."
        },
        {
          "fundstelle": "S. 11–13",
          "aussage": "Lokaler Betrieb, Systemanweisungen, Prompt Injection, Integration in das ISMS, Rollen, Protokollierung und Außerbetriebnahme."
        },
        {
          "fundstelle": "S. 14–16",
          "aussage": "Robustheit, Fehlverhalten, eingeschleuste Anweisungen, gezielte Manipulation von Modellen oder Wissensquellen, Datenabfluss, Datenschutz und Verfügbarkeit."
        }
      ],
      "abgeleitete_kontrollen": [
        "ki-agt-001",
        "ki-api-001",
        "ki-api-002",
        "ki-arc-002",
        "ki-dec-001",
        "ki-ext-001",
        "ki-ext-002",
        "ki-gel-001",
        "ki-gov-001",
        "ki-gov-002",
        "ki-gov-003",
        "ki-iam-001",
        "ki-mod-001",
        "ki-mod-002",
        "ki-ops-001",
        "ki-ops-002",
        "ki-ops-003",
        "ki-out-001",
        "ki-pmt-001",
        "ki-rag-002",
        "ki-rec-001",
        "ki-thr-001",
        "ki-thr-002",
        "ki-tol-001",
        "ki-tol-002",
        "ki-trn-001",
        "ki-val-001",
        "ki-val-002"
      ]
    },
    {
      "id": "Q-BSI-2002-001",
      "oscal_uuid": "8baf4137-32c2-4a3b-b285-084cb6113cb4",
      "titel": "BSI-Standard 200-2: IT-Grundschutz-Methodik",
      "herausgeber": "Bundesamt für Sicherheit in der Informationstechnik",
      "dokumentart": "Behördlicher Standard",
      "fassung": "Version 1.0",
      "stand": "Oktober 2017",
      "veröffentlichungsdatum": "2017-10-01",
      "gültigkeitsdatum": null,
      "öffentliche_url": "https://www.bsi.bund.de/SharedDocs/Downloads/DE/BSI/Grundschutz/BSI_Standards/standard_200_2.pdf?__blob=publicationFile&v=2",
      "abrufdatum": "2026-09-03",
      "letzte_inhaltsprüfung": "2026-09-03",
      "lokale_fassung": {
        "pfad": "quellen/lokale-eingaben/standard_200_2.pdf",
        "dateigröße_bytes": 4211031,
        "sha256": "af0962c5b3f6763f8aa7927ee5da749ee0fed1fcadbf26b22c0ab26f6b9f6a1a",
        "offizielle_pdf_url": "https://www.bsi.bund.de/SharedDocs/Downloads/DE/BSI/Grundschutz/BSI_Standards/standard_200_2.pdf?__blob=publicationFile&v=2",
        "offizielle_sha256_am_prüftag": "af0962c5b3f6763f8aa7927ee5da749ee0fed1fcadbf26b22c0ab26f6b9f6a1a",
        "vergleich": "binär-identisch"
      },
      "seitenzahl": 180,
      "geltungsbereich": "IT-Grundschutz-Methodik und Aufbau eines Informationssicherheitsmanagementsystems",
      "autoritätsstufe": "2-bsi-standard",
      "lizenz_und_wiederverwendung": "Behördliche Veröffentlichung; nur kurze sinngemäße Ableitungen und bibliografische Angaben genutzt.",
      "aktualitätsstatus": "geprüft",
      "vorgänger": "BSI-Standard 100-2",
      "nachfolger": null,
      "wiedervorlage_am": "2027-09-03",
      "verwendete_fundstellen": [
        {
          "fundstelle": "S. 11 und S. 69–74",
          "aussage": "Ganzheitlicher Sicherheitsprozess, Festlegung des Geltungsbereichs, Strukturanalyse, Schutzbedarfsfeststellung, Modellierung und Sicherheitsprüfung."
        },
        {
          "fundstelle": "S. 154–156",
          "aussage": "Risikoanalyse, Vergleich der Risikolage vor und nach zusätzlichen Maßnahmen sowie Zusammenführung in das Sicherheitskonzept."
        }
      ],
      "abgeleitete_kontrollen": [
        "ki-gel-001"
      ]
    },
    {
      "id": "Q-BSI-2003-001",
      "oscal_uuid": "4b0577d2-73dc-4156-8131-6eac7fb22003",
      "titel": "BSI-Standard 200-3: Risikomanagement",
      "herausgeber": "Bundesamt für Sicherheit in der Informationstechnik",
      "dokumentart": "Behördlicher Standard",
      "fassung": "Version 1.0",
      "stand": "Oktober 2017",
      "veröffentlichungsdatum": "2017-10-01",
      "gültigkeitsdatum": null,
      "öffentliche_url": "https://www.bsi.bund.de/SharedDocs/Downloads/DE/BSI/Grundschutz/BSI_Standards/standard_200_3.pdf?__blob=publicationFile&v=2",
      "abrufdatum": "2026-09-03",
      "letzte_inhaltsprüfung": "2026-09-03",
      "lokale_fassung": {
        "pfad": "quellen/lokale-eingaben/standard_200_3.pdf",
        "dateigröße_bytes": 2236578,
        "sha256": "639a089dd74b9f7c6ec70a9b37443c97bd15cdf65a707d769bc1ff1ec017c86a",
        "offizielle_pdf_url": "https://www.bsi.bund.de/SharedDocs/Downloads/DE/BSI/Grundschutz/BSI_Standards/standard_200_3.pdf?__blob=publicationFile&v=2",
        "offizielle_sha256_am_prüftag": "639a089dd74b9f7c6ec70a9b37443c97bd15cdf65a707d769bc1ff1ec017c86a",
        "vergleich": "binär-identisch"
      },
      "seitenzahl": 54,
      "geltungsbereich": "Risikoanalyse und Risikobehandlung nach IT-Grundschutz",
      "autoritätsstufe": "2-bsi-standard",
      "lizenz_und_wiederverwendung": "Behördliche Veröffentlichung; nur kurze sinngemäße Ableitungen und bibliografische Angaben genutzt.",
      "aktualitätsstatus": "geprüft",
      "vorgänger": "BSI-Standard 100-3",
      "nachfolger": null,
      "wiedervorlage_am": "2027-09-03",
      "verwendete_fundstellen": [
        {
          "fundstelle": "S. 5–7",